[
  {
    "id": "home",
    "route": "/",
    "title": "首頁",
    "status": "ready",
    "markdown_path": "content/articles/home.md",
    "pattern_ids": [],
    "problem_ids": [],
    "sections": [
      "定位",
      "學習入口"
    ]
  },
  {
    "id": "data-structures",
    "route": "/data-structures",
    "title": "資料結構索引",
    "status": "ready",
    "markdown_path": "content/articles/data-structures/index.md",
    "pattern_ids": [],
    "problem_ids": [],
    "sections": [
      "十種資料結構"
    ]
  },
  {
    "id": "ds-array",
    "route": "/data-structures/array",
    "title": "array",
    "status": "ready",
    "markdown_path": "content/articles/data-structures/array.md",
    "pattern_ids": [],
    "problem_ids": [],
    "sections": [
      "定義",
      "複雜度",
      "適用情境",
      "誤區",
      "圖解"
    ]
  },
  {
    "id": "ds-string",
    "route": "/data-structures/string",
    "title": "string",
    "status": "ready",
    "markdown_path": "content/articles/data-structures/string.md",
    "pattern_ids": [],
    "problem_ids": [],
    "sections": [
      "定義",
      "複雜度",
      "適用情境",
      "誤區",
      "圖解"
    ]
  },
  {
    "id": "ds-hashmap-set",
    "route": "/data-structures/hashmap-set",
    "title": "hashmap-set",
    "status": "ready",
    "markdown_path": "content/articles/data-structures/hashmap-set.md",
    "pattern_ids": [],
    "problem_ids": [],
    "sections": [
      "定義",
      "複雜度",
      "適用情境",
      "誤區",
      "圖解"
    ]
  },
  {
    "id": "ds-linked-list",
    "route": "/data-structures/linked-list",
    "title": "linked-list",
    "status": "ready",
    "markdown_path": "content/articles/data-structures/linked-list.md",
    "pattern_ids": [],
    "problem_ids": [],
    "sections": [
      "定義",
      "複雜度",
      "適用情境",
      "誤區",
      "圖解"
    ]
  },
  {
    "id": "ds-stack",
    "route": "/data-structures/stack",
    "title": "stack",
    "status": "ready",
    "markdown_path": "content/articles/data-structures/stack.md",
    "pattern_ids": [],
    "problem_ids": [],
    "sections": [
      "定義",
      "複雜度",
      "適用情境",
      "誤區",
      "圖解"
    ]
  },
  {
    "id": "ds-queue",
    "route": "/data-structures/queue",
    "title": "queue",
    "status": "ready",
    "markdown_path": "content/articles/data-structures/queue.md",
    "pattern_ids": [],
    "problem_ids": [],
    "sections": [
      "定義",
      "複雜度",
      "適用情境",
      "誤區",
      "圖解"
    ]
  },
  {
    "id": "ds-heap",
    "route": "/data-structures/heap",
    "title": "heap",
    "status": "ready",
    "markdown_path": "content/articles/data-structures/heap.md",
    "pattern_ids": [],
    "problem_ids": [],
    "sections": [
      "定義",
      "複雜度",
      "適用情境",
      "誤區",
      "圖解"
    ]
  },
  {
    "id": "ds-tree",
    "route": "/data-structures/tree",
    "title": "tree",
    "status": "ready",
    "markdown_path": "content/articles/data-structures/tree.md",
    "pattern_ids": [],
    "problem_ids": [],
    "sections": [
      "定義",
      "複雜度",
      "適用情境",
      "誤區",
      "圖解"
    ]
  },
  {
    "id": "ds-graph",
    "route": "/data-structures/graph",
    "title": "graph",
    "status": "ready",
    "markdown_path": "content/articles/data-structures/graph.md",
    "pattern_ids": [],
    "problem_ids": [],
    "sections": [
      "定義",
      "複雜度",
      "適用情境",
      "誤區",
      "圖解"
    ]
  },
  {
    "id": "ds-union-find",
    "route": "/data-structures/union-find",
    "title": "union-find",
    "status": "ready",
    "markdown_path": "content/articles/data-structures/union-find.md",
    "pattern_ids": [],
    "problem_ids": [],
    "sections": [
      "定義",
      "複雜度",
      "適用情境",
      "誤區",
      "圖解"
    ]
  },
  {
    "id": "languages",
    "route": "/languages",
    "title": "語言對照",
    "status": "ready",
    "markdown_path": "content/articles/languages.md",
    "pattern_ids": [],
    "problem_ids": [],
    "sections": [
      "陣列",
      "字串",
      "雜湊表",
      "集合",
      "堆疊",
      "佇列",
      "優先佇列",
      "排序"
    ]
  },
  {
    "id": "templates",
    "route": "/templates",
    "title": "模板索引",
    "status": "ready",
    "markdown_path": "content/articles/templates/index.md",
    "pattern_ids": [],
    "problem_ids": [],
    "sections": [
      "搜尋",
      "六種模式"
    ]
  },
  {
    "id": "template-sliding-window",
    "route": "/templates/sliding-window",
    "title": "sliding-window",
    "status": "ready",
    "markdown_path": "content/articles/templates/sliding-window.md",
    "pattern_ids": [
      "sliding-window"
    ],
    "problem_ids": [
      "leetcode-643",
      "leetcode-3",
      "leetcode-209",
      "leetcode-76",
      "leetcode-567",
      "leetcode-239"
    ],
    "sections": [
      "辨識",
      "前提",
      "反例",
      "三語言標準模板",
      "複雜度",
      "題目索引"
    ]
  },
  {
    "id": "template-binary-search",
    "route": "/templates/binary-search",
    "title": "binary-search",
    "status": "ready",
    "markdown_path": "content/articles/templates/binary-search.md",
    "pattern_ids": [
      "binary-search"
    ],
    "problem_ids": [
      "leetcode-704",
      "leetcode-34",
      "leetcode-33",
      "leetcode-875",
      "leetcode-1011"
    ],
    "sections": [
      "辨識",
      "前提",
      "反例",
      "三語言標準模板",
      "複雜度",
      "題目索引"
    ]
  },
  {
    "id": "template-two-pointers",
    "route": "/templates/two-pointers",
    "title": "two-pointers",
    "status": "ready",
    "markdown_path": "content/articles/templates/two-pointers.md",
    "pattern_ids": [
      "two-pointers"
    ],
    "problem_ids": [
      "leetcode-167",
      "leetcode-11",
      "leetcode-141",
      "leetcode-876",
      "leetcode-15",
      "leetcode-283",
      "leetcode-26"
    ],
    "sections": [
      "辨識",
      "前提",
      "反例",
      "三語言標準模板",
      "複雜度",
      "題目索引"
    ]
  },
  {
    "id": "template-bfs-dfs",
    "route": "/templates/bfs-dfs",
    "title": "bfs-dfs",
    "status": "ready",
    "markdown_path": "content/articles/templates/bfs-dfs.md",
    "pattern_ids": [
      "bfs-dfs"
    ],
    "problem_ids": [],
    "sections": [
      "辨識",
      "前提",
      "反例",
      "三語言標準模板",
      "複雜度",
      "題目索引"
    ]
  },
  {
    "id": "template-backtracking",
    "route": "/templates/backtracking",
    "title": "backtracking",
    "status": "ready",
    "markdown_path": "content/articles/templates/backtracking.md",
    "pattern_ids": [
      "backtracking"
    ],
    "problem_ids": [
      "leetcode-78"
    ],
    "sections": [
      "辨識",
      "前提",
      "反例",
      "三語言標準模板",
      "複雜度",
      "題目索引"
    ]
  },
  {
    "id": "template-dp",
    "route": "/templates/dp",
    "title": "dp",
    "status": "ready",
    "markdown_path": "content/articles/templates/dp.md",
    "pattern_ids": [
      "dp"
    ],
    "problem_ids": [
      "leetcode-198"
    ],
    "sections": [
      "辨識",
      "前提",
      "反例",
      "三語言標準模板",
      "複雜度",
      "題目索引"
    ]
  },
  {
    "id": "guided-learning",
    "route": "/guided-learning",
    "title": "引導教學索引",
    "status": "ready",
    "markdown_path": "content/articles/guided-learning/index.md",
    "pattern_ids": [],
    "problem_ids": [],
    "sections": [
      "六篇教學"
    ]
  },
  {
    "id": "guide-sliding-window",
    "route": "/guided-learning/sliding-window",
    "title": "sliding-window 代表題",
    "status": "ready",
    "markdown_path": "content/articles/guided-learning/sliding-window.md",
    "pattern_ids": [
      "sliding-window"
    ],
    "problem_ids": [
      "leetcode-209"
    ],
    "sections": [
      "辨識",
      "暴力解",
      "關鍵觀察",
      "虛擬碼與三語言",
      "複雜度與延伸"
    ]
  },
  {
    "id": "guide-binary-search",
    "route": "/guided-learning/binary-search",
    "title": "binary-search 代表題",
    "status": "ready",
    "markdown_path": "content/articles/guided-learning/binary-search.md",
    "pattern_ids": [
      "binary-search"
    ],
    "problem_ids": [
      "leetcode-875"
    ],
    "sections": [
      "辨識",
      "暴力解",
      "關鍵觀察",
      "虛擬碼與三語言",
      "複雜度與延伸"
    ]
  },
  {
    "id": "guide-two-pointers",
    "route": "/guided-learning/two-pointers",
    "title": "two-pointers 代表題",
    "status": "ready",
    "markdown_path": "content/articles/guided-learning/two-pointers.md",
    "pattern_ids": [
      "two-pointers"
    ],
    "problem_ids": [
      "leetcode-11"
    ],
    "sections": [
      "辨識",
      "暴力解",
      "關鍵觀察",
      "虛擬碼與三語言",
      "複雜度與延伸"
    ]
  },
  {
    "id": "guide-bfs-dfs",
    "route": "/guided-learning/bfs-dfs",
    "title": "bfs-dfs 代表題",
    "status": "ready",
    "markdown_path": "content/articles/guided-learning/bfs-dfs.md",
    "pattern_ids": [
      "bfs-dfs"
    ],
    "problem_ids": [
      "leetcode-200"
    ],
    "sections": [
      "辨識",
      "暴力解",
      "關鍵觀察",
      "虛擬碼與三語言",
      "複雜度與延伸"
    ]
  },
  {
    "id": "guide-backtracking",
    "route": "/guided-learning/backtracking",
    "title": "backtracking 代表題",
    "status": "ready",
    "markdown_path": "content/articles/guided-learning/backtracking.md",
    "pattern_ids": [
      "backtracking"
    ],
    "problem_ids": [
      "leetcode-78"
    ],
    "sections": [
      "辨識",
      "暴力解",
      "關鍵觀察",
      "虛擬碼與三語言",
      "複雜度與延伸"
    ]
  },
  {
    "id": "guide-dp",
    "route": "/guided-learning/dp",
    "title": "dp 代表題",
    "status": "ready",
    "markdown_path": "content/articles/guided-learning/dp.md",
    "pattern_ids": [
      "dp"
    ],
    "problem_ids": [
      "leetcode-198"
    ],
    "sections": [
      "辨識",
      "暴力解",
      "關鍵觀察",
      "虛擬碼與三語言",
      "複雜度與延伸"
    ]
  },
  {
    "id": "roadmap",
    "route": "/roadmap",
    "title": "學習路徑",
    "status": "ready",
    "markdown_path": "content/articles/roadmap.md",
    "pattern_ids": [
      "two-pointers",
      "sliding-window",
      "binary-search",
      "bfs-dfs",
      "backtracking",
      "dp"
    ],
    "problem_ids": [
      "leetcode-167",
      "leetcode-11",
      "leetcode-15",
      "leetcode-643",